{
  "$schema": "https://json-schema.org/draft/2020-12/schema",
  "$id": "https://sustainablecatalyst.com/schemas/scfs-release-board-v1.schema.json",
  "title": "Sustainable Catalyst Release Console",
  "type": "object",
  "required": [
    "schema",
    "version",
    "layout",
    "context",
    "groups"
  ],
  "properties": {
    "schema": {
      "const": "scfs-release-board/1.3"
    },
    "version": {
      "const": "7.5.5"
    },
    "layout": {
      "enum": [
        "terminal",
        "blackboard",
        "compact",
        "directory"
      ]
    },
    "context": {
      "enum": [
        "homepage",
        "directory",
        "generic"
      ]
    },
    "generated_at": {
      "type": "string"
    },
    "summary": {
      "type": "object",
      "properties": {
        "total_products": {
          "type": "integer",
          "minimum": 0
        },
        "wordpress_plugin_count": {
          "type": "integer",
          "minimum": 0
        },
        "manual_count": {
          "type": "integer",
          "minimum": 0
        },
        "other_source_count": {
          "type": "integer",
          "minimum": 0
        }
      },
      "additionalProperties": false
    },
    "groups": {
      "type": "array",
      "items": {
        "type": "object",
        "required": [
          "family",
          "label",
          "products"
        ],
        "properties": {
          "family": {
            "enum": [
              "foundation",
              "research-intelligence",
              "data-analysis",
              "creation-systems",
              "commercial"
            ]
          },
          "label": {
            "type": "string"
          },
          "products": {
            "type": "array",
            "items": {
              "type": "object",
              "required": [
                "canonical_id",
                "name",
                "version",
                "status"
              ],
              "properties": {
                "canonical_id": {
                  "type": "string",
                  "pattern": "^[a-z0-9]+(?:-[a-z0-9]+)*$"
                },
                "name": {
                  "type": "string"
                },
                "version": {
                  "type": "string"
                },
                "status": {
                  "type": "string"
                },
                "version_source": {
                  "enum": [
                    "wordpress_plugin",
                    "github_release",
                    "manual",
                    "remote_manifest",
                    "service_endpoint",
                    "package_manifest"
                  ]
                },
                "product_url": {
                  "type": "string"
                },
                "release_notes_url": {
                  "type": "string"
                },
                "previous_version": {
                  "type": "string"
                },
                "release_date": {
                  "type": "string"
                },
                "change_summary": {
                  "type": "string",
                  "maxLength": 240
                },
                "validation_state": {
                  "enum": [
                    "validated",
                    "partial",
                    "pending",
                    "failed",
                    "unavailable"
                  ]
                },
                "documentation_state": {
                  "enum": [
                    "ready",
                    "partial",
                    "missing",
                    "unavailable"
                  ]
                },
                "known_issue_count": {
                  "type": "integer",
                  "minimum": 0
                },
                "recently_updated": {
                  "type": "boolean"
                },
                "lifecycle_state": {
                  "type": "string"
                },
                "console_screen": {
                  "type": "string"
                },
                "version_precedence": {
                  "type": "string"
                },
                "verification_source": {
                  "type": "string"
                },
                "source_verified_at": {
                  "type": "string"
                },
                "github_repository_url": {
                  "type": "string"
                },
                "github_latest_release_url": {
                  "type": "string"
                },
                "github_latest_commit_sha": {
                  "type": "string"
                },
                "github_repository_updated_at": {
                  "type": "string"
                }
              },
              "additionalProperties": false
            }
          }
        },
        "additionalProperties": false
      }
    },
    "copy": {
      "type": "object",
      "properties": {
        "title": {
          "type": "string"
        },
        "intro": {
          "type": "string"
        },
        "screen_labels": {
          "type": "object",
          "additionalProperties": {
            "type": "string"
          }
        },
        "control_labels": {
          "type": "object",
          "additionalProperties": {
            "type": "string"
          }
        },
        "footer_labels": {
          "type": "object",
          "additionalProperties": {
            "type": "string"
          }
        }
      },
      "additionalProperties": false
    }
  },
  "additionalProperties": false
}
