{
  "schema": "scfs-release-board/1.3",
  "version": "7.5.5",
  "layout": "terminal",
  "context": "homepage",
  "generated_at": "2026-07-22T00:00:00Z",
  "summary": {
    "total_products": 6,
    "wordpress_plugin_count": 4,
    "manual_count": 2,
    "other_source_count": 0
  },
  "groups": [
    {
      "family": "foundation",
      "label": "Foundation",
      "products": [
        {
          "canonical_id": "sustainable-catalyst-core",
          "name": "Core",
          "version": "3.0.0",
          "status": "current",
          "version_source": "wordpress_plugin",
          "product_url": "",
          "release_notes_url": "",
          "console_screen": "foundation",
          "lifecycle_state": "active",
          "version_precedence": "discovered",
          "verification_source": "wordpress_plugin",
          "source_verified_at": "2026-07-22T00:00:00Z",
          "previous_version": "",
          "release_date": "",
          "change_summary": "",
          "validation_state": "pending",
          "documentation_state": "unavailable",
          "known_issue_count": 0,
          "recently_updated": false
        },
        {
          "canonical_id": "product-support-feedback",
          "name": "Support and Feedback",
          "version": "7.5.5",
          "status": "current",
          "version_source": "wordpress_plugin",
          "product_url": "/support/",
          "release_notes_url": "/support/releases/",
          "console_screen": "foundation",
          "lifecycle_state": "active",
          "version_precedence": "discovered",
          "verification_source": "wordpress_plugin",
          "source_verified_at": "2026-07-22T00:00:00Z",
          "previous_version": "7.4.0",
          "release_date": "2026-07-22",
          "change_summary": "Release intelligence and editable console presentation copy.",
          "validation_state": "validated",
          "documentation_state": "ready",
          "known_issue_count": 0,
          "recently_updated": true
        },
        {
          "canonical_id": "contact-engagement",
          "name": "Contact and Engagement",
          "version": "2.0.0",
          "status": "current",
          "version_source": "wordpress_plugin",
          "product_url": "/contact/",
          "release_notes_url": "",
          "console_screen": "foundation",
          "lifecycle_state": "active",
          "version_precedence": "discovered",
          "verification_source": "wordpress_plugin",
          "source_verified_at": "2026-07-22T00:00:00Z",
          "previous_version": "",
          "release_date": "",
          "change_summary": "",
          "validation_state": "pending",
          "documentation_state": "unavailable",
          "known_issue_count": 0,
          "recently_updated": false
        },
        {
          "canonical_id": "knowledge-library",
          "name": "Knowledge Library",
          "version": "4.0.2",
          "status": "current",
          "version_source": "wordpress_plugin",
          "product_url": "/library/",
          "release_notes_url": "",
          "console_screen": "foundation",
          "lifecycle_state": "active",
          "version_precedence": "discovered",
          "verification_source": "wordpress_plugin",
          "source_verified_at": "2026-07-22T00:00:00Z",
          "previous_version": "",
          "release_date": "",
          "change_summary": "",
          "validation_state": "pending",
          "documentation_state": "unavailable",
          "known_issue_count": 0,
          "recently_updated": false
        }
      ]
    },
    {
      "family": "data-analysis",
      "label": "Data and Analysis",
      "products": [
        {
          "canonical_id": "catalyst-analytics-r",
          "name": "Analytics R",
          "version": "2.0.0",
          "status": "current",
          "version_source": "manual",
          "product_url": "",
          "release_notes_url": "",
          "console_screen": "data-analysis",
          "lifecycle_state": "active",
          "version_precedence": "manual",
          "verification_source": "release_manifest",
          "source_verified_at": "2026-07-22T00:00:00Z",
          "previous_version": "",
          "release_date": "",
          "change_summary": "",
          "validation_state": "pending",
          "documentation_state": "unavailable",
          "known_issue_count": 0,
          "recently_updated": false
        }
      ]
    },
    {
      "family": "commercial",
      "label": "Commercial Platform",
      "products": [
        {
          "canonical_id": "catalyst-intelligence",
          "name": "Catalyst Intelligence",
          "version": "0.23.1",
          "status": "development",
          "version_source": "manual",
          "product_url": "",
          "release_notes_url": "",
          "console_screen": "commercial",
          "lifecycle_state": "planned",
          "version_precedence": "manual",
          "verification_source": "release_manifest",
          "source_verified_at": "2026-07-22T00:00:00Z",
          "previous_version": "",
          "release_date": "",
          "change_summary": "",
          "validation_state": "pending",
          "documentation_state": "unavailable",
          "known_issue_count": 0,
          "recently_updated": false
        }
      ]
    }
  ],
  "copy": {
    "title": "Release Console",
    "intro": "Five governed release screens rotating across the Sustainable Catalyst platform.",
    "screen_labels": {
      "foundation": "Foundation",
      "research-intelligence": "Research and Intelligence",
      "data-analysis": "Data and Analysis",
      "creation-systems": "Creation and Systems",
      "commercial": "Commercial Release"
    },
    "control_labels": {
      "previous": "Previous",
      "pause": "Pause",
      "play": "Play",
      "next": "Next"
    },
    "footer_labels": {
      "releases": "releases",
      "support": "support"
    }
  }
}
